{
  "schema_version": "1.0.0",
  "experiment_id": "bb379f6868258f913a2fcbbc9d5fdfe48fd1f0061fa1432a1a1347b9da77b909",
  "seed_status": "EXISTING_SAVED_PLANS_FROM_SEEDED_SEARCH_IDENTICAL_IN_ALL_CONDITIONS",
  "budget": {
    "max_iterations": 2,
    "max_tool_calls": 200,
    "max_wall_seconds": 600,
    "max_new_spend": 0
  },
  "cases": [
    {
      "id": "restaurante",
      "input_sha256": "d8295cb9d43dd45f09ffefafeb882d922c0a91fdca8484d12b526e29b14e8622",
      "data_mode": "SYNTHETIC_FIXTURE",
      "variants": [
        {
          "condition": "A",
          "flags": {
            "impeccable": false,
            "raven": false
          },
          "design": {
            "schema_version": "1.0.0",
            "id": "candidate-01",
            "art_direction_id": "typographic-pause",
            "site_plan_id": "fixture-restaurante-001-snapshot-v1:h2-plan:682afd241f624cef533b4097",
            "plan_sha256": "4095293f66936680f0de4f49dc03410ec436154e89646da514a5307af8fa5f22",
            "content_sha256": "6fbe1021d1e6fd1249c04d4ebf99df477ee49bdb70e3373730d826f7b97d4c8b",
            "manifest_sha256": "233a731c012e82d0c78836aa715dd215083f9e3e51c0de282283e01378d1d948",
            "context_sha256": "ab9dc6c2b2cf325f07cd4afd45de0ce467184a3b1b5c54b55c0acda8c3056f38",
            "registry_version": "h5-lab-1.0.0",
            "tokens": {
              "palette": "olive",
              "type": "serif",
              "hierarchy": "monument",
              "rhythm": "quiet",
              "media_width": "inset",
              "media_alignment": "center"
            },
            "motion": "quiet",
            "pages": [
              {
                "path": "/",
                "composition": {
                  "operator": "Rail",
                  "navigation": "before-content",
                  "child": {
                    "operator": "Sequence",
                    "module_refs": [
                      "semantic-7bf9d33184f7e923438acadd"
                    ],
                    "media_usage_refs": [
                      "h3-real-pilot-atmospheric"
                    ]
                  }
                }
              },
              {
                "path": "/sedes/s-051d544b94ae77ae0d73a35b/menu",
                "composition": {
                  "operator": "Rail",
                  "navigation": "before-content",
                  "child": {
                    "operator": "Sequence",
                    "module_refs": [
                      "semantic-70d73044727ca9b106d272a8"
                    ],
                    "media_usage_refs": []
                  }
                }
              }
            ]
          },
          "refinement": {
            "schema_version": "1.0.0",
            "reading_measure": "incumbent",
            "touch_targets": "incumbent",
            "type_rhythm": "incumbent",
            "tracking": "incumbent",
            "label_placement": "incumbent"
          },
          "iteration": 0,
          "trace": []
        },
        {
          "condition": "B",
          "flags": {
            "impeccable": true,
            "raven": false
          },
          "design": {
            "schema_version": "1.0.0",
            "id": "candidate-01",
            "art_direction_id": "typographic-pause",
            "site_plan_id": "fixture-restaurante-001-snapshot-v1:h2-plan:682afd241f624cef533b4097",
            "plan_sha256": "4095293f66936680f0de4f49dc03410ec436154e89646da514a5307af8fa5f22",
            "content_sha256": "6fbe1021d1e6fd1249c04d4ebf99df477ee49bdb70e3373730d826f7b97d4c8b",
            "manifest_sha256": "233a731c012e82d0c78836aa715dd215083f9e3e51c0de282283e01378d1d948",
            "context_sha256": "ab9dc6c2b2cf325f07cd4afd45de0ce467184a3b1b5c54b55c0acda8c3056f38",
            "registry_version": "h5-lab-1.0.0",
            "tokens": {
              "palette": "olive",
              "type": "serif",
              "hierarchy": "monument",
              "rhythm": "quiet",
              "media_width": "inset",
              "media_alignment": "center"
            },
            "motion": "quiet",
            "pages": [
              {
                "path": "/",
                "composition": {
                  "operator": "Rail",
                  "navigation": "before-content",
                  "child": {
                    "operator": "Sequence",
                    "module_refs": [
                      "semantic-7bf9d33184f7e923438acadd"
                    ],
                    "media_usage_refs": [
                      "h3-real-pilot-atmospheric"
                    ]
                  }
                }
              },
              {
                "path": "/sedes/s-051d544b94ae77ae0d73a35b/menu",
                "composition": {
                  "operator": "Rail",
                  "navigation": "before-content",
                  "child": {
                    "operator": "Sequence",
                    "module_refs": [
                      "semantic-70d73044727ca9b106d272a8"
                    ],
                    "media_usage_refs": []
                  }
                }
              }
            ]
          },
          "refinement": {
            "schema_version": "1.0.0",
            "reading_measure": "incumbent",
            "touch_targets": "incumbent",
            "type_rhythm": "reading",
            "tracking": "natural",
            "label_placement": "after-title"
          },
          "iteration": 1,
          "trace": [
            {
              "source": "IMPECCABLE_AGENT_GUIDANCE",
              "evidence": [
                {
                  "path": ".agents/skills/impeccable/SKILL.md",
                  "sha256": "cc6682b9617d62d2c40fd60812d97d34ec28b32a820f9472647c33f47e2e6d72"
                },
                {
                  "path": ".agents/skills/impeccable/reference/craft.md",
                  "sha256": "c77d7dd5ee4cb1ad2ef6d016c0eee07aebe1c7ff3769a7d99ac4b5b453c33c11"
                },
                {
                  "path": ".agents/skills/impeccable/reference/craft-floor.md",
                  "sha256": "5f2cf2ad1c40d52d95d3de7d75a31dbafe2a036a505c89d52d71c545d6d4731a"
                },
                {
                  "path": ".agents/skills/impeccable/reference/audit.md",
                  "sha256": "caf21df33771e760ef4d8ccca78fe9c309c6e9480ef26b3f70862a5a39af44a6"
                },
                {
                  "path": ".agents/skills/impeccable/reference/polish.md",
                  "sha256": "be4ea0accf3622da7b7a6054c55d9c6aefa18ff5ee908621e908333d36b0f82c"
                },
                {
                  "path": ".agents/skills/impeccable/reference/distill.md",
                  "sha256": "3f9e2a162ec5655fdbb6778e592cbff95c34bf27f0b26981acee2c1d89c1176d"
                }
              ],
              "decisions": [
                "tracking:natural",
                "label_placement:after-title"
              ],
              "note": "Applied by this Codex session; not an autonomous CLI craft/polish call. Refinement of existing visual world, no new identity."
            },
            {
              "source": "BOUNDED_REPAIR",
              "audit_sha256": "d28619fb05ad2efca4c8d960c8f2ca3373742903bac47ebe3d18ae840f343d74",
              "reason_ids": [
                "4c426987d41aaa851403fc38",
                "c0f612a18cd6184ee3cf5a16",
                "b0e6ed97d374488b9260a826",
                "b00b177c79d0de957b995a57",
                "a09e74da39247d0fb1c476c8",
                "883af9f7091aba46904eb3af",
                "4d47df058a62df04c0088a42",
                "a4d4ca35633b778da4ee2658",
                "f70eebfcb1486eff80ce7195",
                "72c035076f0474df32ef5fdf",
                "b68792955c75f27c5603a09b",
                "12e1a1b396ed166a8ba42a0d",
                "de60d06599af8a071d3ddcc2",
                "13858aa54df618a5b39c33d9",
                "a55bdca3432eb4b1259e73cf",
                "18928d0439360534911d9460",
                "9bc14bffa0bc2f153b3e5f0e",
                "a66f345953d1d95cad048f2d"
              ]
            }
          ]
        },
        {
          "condition": "C",
          "flags": {
            "impeccable": false,
            "raven": true
          },
          "design": {
            "schema_version": "1.0.0",
            "id": "candidate-01",
            "art_direction_id": "typographic-pause",
            "site_plan_id": "fixture-restaurante-001-snapshot-v1:h2-plan:682afd241f624cef533b4097",
            "plan_sha256": "4095293f66936680f0de4f49dc03410ec436154e89646da514a5307af8fa5f22",
            "content_sha256": "6fbe1021d1e6fd1249c04d4ebf99df477ee49bdb70e3373730d826f7b97d4c8b",
            "manifest_sha256": "233a731c012e82d0c78836aa715dd215083f9e3e51c0de282283e01378d1d948",
            "context_sha256": "ab9dc6c2b2cf325f07cd4afd45de0ce467184a3b1b5c54b55c0acda8c3056f38",
            "registry_version": "h5-lab-1.0.0",
            "tokens": {
              "palette": "olive",
              "type": "serif",
              "hierarchy": "monument",
              "rhythm": "quiet",
              "media_width": "inset",
              "media_alignment": "center"
            },
            "motion": "quiet",
            "pages": [
              {
                "path": "/",
                "composition": {
                  "operator": "Rail",
                  "navigation": "before-content",
                  "child": {
                    "operator": "Sequence",
                    "module_refs": [
                      "semantic-7bf9d33184f7e923438acadd"
                    ],
                    "media_usage_refs": [
                      "h3-real-pilot-atmospheric"
                    ]
                  }
                }
              },
              {
                "path": "/sedes/s-051d544b94ae77ae0d73a35b/menu",
                "composition": {